<?xml version="1.0" encoding="UTF-8"?>
<!-- edited with XML Spy v3.5 NT (http://www.xmlspy.com) by Jordan Reed (Chaos, INC.) -->
<!DOCTYPE RollTableRoot SYSTEM "..\RollTable.dtd">
<RollTableRoot>
	<RollTable min="1" max="100" open="FALSE">
		<FinderObject objectClass="com.chaosserver.merp.rules.profession.Profession" finderClass="com.chaosserver.merp.rules.profession.ProfessionFinder" finderKey="Name"/>
		<Row min="1" max="30">
			<PrimaryKey>Warrior</PrimaryKey>
		</Row>
		<Row min="31" max="50">
			<PrimaryKey>Scout</PrimaryKey>
		</Row>
		<Row min="51" max="70">
			<PrimaryKey>Ranger</PrimaryKey>
		</Row>
		<Row min="71" max="75">
			<PrimaryKey>Mage</PrimaryKey>
		</Row>
		<Row min="76" max="80">
			<PrimaryKey>Animist</PrimaryKey>
		</Row>
		<Row min="81" max="100">
			<PrimaryKey>Bard</PrimaryKey>
		</Row>
	</RollTable>
</RollTableRoot>